{
  "schemaVersion": 1,
  "defaultProfileId": "warm-studio",
  "storageKey": "dpp.presentation.v1",
  "paletteRevision": "theme-aligned-2026-08-29",
  "paletteNote": "Theme-native implementation values selected for legibility and contrast; they are not source-extracted swatches.",
  "profiles": [
    {
      "id": "warm-studio",
      "displayName": "Warm Studio",
      "description": "Low-glare warm neutrals, restrained copper brand accents, and deep teal interaction cues.",
      "paletteProvenance": "implementation-defined",
      "colorScheme": "light",
      "themeColor": "#F7F3EC",
      "shell": "persistent-domain-sidebar",
      "profile": "standard",
      "density": "comfortable",
      "surfaceEmphasis": "quiet",
      "typography": "humanist",
      "geometry": "soft",
      "chartStyle": "solid",
      "effects": "quiet",
      "tokens": {
        "canvas": "#EFEAE2",
        "chrome": "#F7F3EC",
        "header": "#F7F3EC",
        "page": "#FFFDF9",
        "surface": "#FFFFFF",
        "surfaceSubtle": "#F4EFE8",
        "surfaceRaised": "#FFFFFF",
        "text": "#24211D",
        "textMuted": "#625B52",
        "textSubtle": "#756D63",
        "border": "#D8D0C5",
        "borderStrong": "#91887B",
        "chromeText": "#24211D",
        "chromeMuted": "#625B52",
        "chromeBorder": "#D8D0C5",
        "chromeActive": "#3A6570",
        "chromeActiveText": "#FFFFFF",
        "headerText": "#24211D",
        "headerMuted": "#625B52",
        "headerBorder": "#D8D0C5",
        "interaction": "#275F6D",
        "interactionHover": "#194B57",
        "interactionActive": "#194B57",
        "interactionText": "#FFFFFF",
        "focusRing": "#0C7184",
        "brand": "#B45A2A",
        "brandSoft": "#F7DFCF",
        "brandText": "#6E2C12",
        "data1": "#2B6270",
        "data2": "#A44F25",
        "data3": "#6C5794",
        "data4": "#32715D",
        "data5": "#875B0C",
        "data6": "#526E78",
        "dataIncomplete": "#6D756F",
        "dataGrid": "#D8D0C5",
        "healthy": "#2F7D55",
        "healthySurface": "#E1F1E8",
        "healthyText": "#205B3D",
        "warning": "#A66A12",
        "warningSurface": "#F8EBCB",
        "warningText": "#694009",
        "critical": "#B64A43",
        "criticalSurface": "#F7E1DF",
        "criticalText": "#7D2D29",
        "info": "#356E91",
        "infoSurface": "#E2EEF5",
        "infoText": "#254E67",
        "fontBody": "Inter, -apple-system, BlinkMacSystemFont, 'Segoe UI', Roboto, Helvetica, Arial, sans-serif",
        "fontDisplay": "Inter, -apple-system, BlinkMacSystemFont, 'Segoe UI', Roboto, Helvetica, Arial, sans-serif",
        "fontDetail": "Inter, -apple-system, BlinkMacSystemFont, 'Segoe UI', Roboto, Helvetica, Arial, sans-serif",
        "headingWeight": "760",
        "kpiWeight": "760",
        "bodySize": "16px",
        "metadataSize": "14px",
        "radiusSmall": "8px",
        "radiusMedium": "12px",
        "radiusLarge": "18px",
        "radiusPill": "999px",
        "borderWidth": "1px",
        "controlHeight": "42px",
        "motionDuration": "160ms",
        "shadowLow": "0 8px 22px #342B1D12",
        "shadowHigh": "0 18px 48px #342B1D1F",
        "panelTexture": "none"
      }
    },
    {
      "id": "midnight-saffron",
      "displayName": "Midnight & Saffron",
      "description": "Midnight chrome anchors a calm light workspace with deliberate saffron brand emphasis.",
      "paletteProvenance": "implementation-defined",
      "colorScheme": "light",
      "themeColor": "#172033",
      "shell": "persistent-domain-sidebar",
      "profile": "standard",
      "density": "comfortable",
      "surfaceEmphasis": "tinted",
      "typography": "humanist",
      "geometry": "soft",
      "chartStyle": "solid",
      "effects": "quiet",
      "tokens": {
        "canvas": "#E9EDF2",
        "chrome": "#172033",
        "header": "#172033",
        "page": "#F8F9FB",
        "surface": "#FFFFFF",
        "surfaceSubtle": "#EEF1F5",
        "surfaceRaised": "#FFFFFF",
        "text": "#18202C",
        "textMuted": "#536071",
        "textSubtle": "#647083",
        "border": "#D1D8E1",
        "borderStrong": "#7A8798",
        "chromeText": "#F7F4EC",
        "chromeMuted": "#BAC5D3",
        "chromeBorder": "#354158",
        "chromeActive": "#F1C35A",
        "chromeActiveText": "#2C220A",
        "headerText": "#F7F4EC",
        "headerMuted": "#BAC5D3",
        "headerBorder": "#354158",
        "interaction": "#315C88",
        "interactionHover": "#24486C",
        "interactionActive": "#24486C",
        "interactionText": "#FFFFFF",
        "focusRing": "#227D94",
        "brand": "#C98A18",
        "brandSoft": "#F7E7B9",
        "brandText": "#664407",
        "data1": "#3D607F",
        "data2": "#8C5A0D",
        "data3": "#6E559B",
        "data4": "#287765",
        "data5": "#9A5930",
        "data6": "#5F681D",
        "dataIncomplete": "#697587",
        "dataGrid": "#D1D8E1",
        "healthy": "#287A54",
        "healthySurface": "#DFF1E7",
        "healthyText": "#1B593B",
        "warning": "#A66313",
        "warningSurface": "#F7E8C8",
        "warningText": "#673C08",
        "critical": "#B74740",
        "criticalSurface": "#F6DFDD",
        "criticalText": "#7A2B26",
        "info": "#326D91",
        "infoSurface": "#E0EDF5",
        "infoText": "#234D67",
        "fontBody": "Inter, -apple-system, BlinkMacSystemFont, 'Segoe UI', Roboto, Helvetica, Arial, sans-serif",
        "fontDisplay": "Inter, -apple-system, BlinkMacSystemFont, 'Segoe UI', Roboto, Helvetica, Arial, sans-serif",
        "fontDetail": "Inter, -apple-system, BlinkMacSystemFont, 'Segoe UI', Roboto, Helvetica, Arial, sans-serif",
        "headingWeight": "760",
        "kpiWeight": "760",
        "bodySize": "16px",
        "metadataSize": "14px",
        "radiusSmall": "8px",
        "radiusMedium": "12px",
        "radiusLarge": "18px",
        "radiusPill": "999px",
        "borderWidth": "1px",
        "controlHeight": "42px",
        "motionDuration": "160ms",
        "shadowLow": "0 8px 22px #11182714",
        "shadowHigh": "0 18px 48px #11182724",
        "panelTexture": "none"
      }
    },
    {
      "id": "aubergine-aqua",
      "displayName": "Aubergine & Aqua",
      "description": "Aubergine chrome and precise aqua interaction create a distinctive but quiet light workspace.",
      "paletteProvenance": "implementation-defined",
      "colorScheme": "light",
      "themeColor": "#3A173F",
      "shell": "persistent-domain-sidebar",
      "profile": "standard",
      "density": "comfortable",
      "surfaceEmphasis": "tinted",
      "typography": "humanist",
      "geometry": "soft",
      "chartStyle": "solid",
      "effects": "quiet",
      "tokens": {
        "canvas": "#EEE9F0",
        "chrome": "#3A173F",
        "header": "#3A173F",
        "page": "#FBF8FB",
        "surface": "#FFFFFF",
        "surfaceSubtle": "#F2ECF3",
        "surfaceRaised": "#FFFFFF",
        "text": "#261C29",
        "textMuted": "#635669",
        "textSubtle": "#796A7E",
        "border": "#DCD1DE",
        "borderStrong": "#95879A",
        "chromeText": "#FFF7FF",
        "chromeMuted": "#DABFDE",
        "chromeBorder": "#634268",
        "chromeActive": "#BFECE7",
        "chromeActiveText": "#28142C",
        "headerText": "#FFF7FF",
        "headerMuted": "#DABFDE",
        "headerBorder": "#634268",
        "interaction": "#0F6D70",
        "interactionHover": "#0A5558",
        "interactionActive": "#0A5558",
        "interactionText": "#FFFFFF",
        "focusRing": "#087F85",
        "brand": "#7A3F83",
        "brandSoft": "#EEDFF1",
        "brandText": "#572A5F",
        "data1": "#236A68",
        "data2": "#6F4C79",
        "data3": "#9C5025",
        "data4": "#3E6F9A",
        "data5": "#647229",
        "data6": "#7A6242",
        "dataIncomplete": "#746A78",
        "dataGrid": "#DCD1DE",
        "healthy": "#287A54",
        "healthySurface": "#E0F1E7",
        "healthyText": "#1A583A",
        "warning": "#A76812",
        "warningSurface": "#F7E9C8",
        "warningText": "#663D08",
        "critical": "#B64A43",
        "criticalSurface": "#F7E0DE",
        "criticalText": "#7B2D29",
        "info": "#256F83",
        "infoSurface": "#DCEFF1",
        "infoText": "#1B4F5D",
        "fontBody": "Inter, -apple-system, BlinkMacSystemFont, 'Segoe UI', Roboto, Helvetica, Arial, sans-serif",
        "fontDisplay": "Inter, -apple-system, BlinkMacSystemFont, 'Segoe UI', Roboto, Helvetica, Arial, sans-serif",
        "fontDetail": "Inter, -apple-system, BlinkMacSystemFont, 'Segoe UI', Roboto, Helvetica, Arial, sans-serif",
        "headingWeight": "760",
        "kpiWeight": "760",
        "bodySize": "16px",
        "metadataSize": "14px",
        "radiusSmall": "8px",
        "radiusMedium": "12px",
        "radiusLarge": "18px",
        "radiusPill": "999px",
        "borderWidth": "1px",
        "controlHeight": "42px",
        "motionDuration": "160ms",
        "shadowLow": "0 8px 22px #3A173F12",
        "shadowHigh": "0 18px 48px #3A173F24",
        "panelTexture": "none"
      }
    },
    {
      "id": "midnight-dark",
      "displayName": "Midnight Dark",
      "description": "Layered navy-black surfaces with cool cyan interaction and a restrained saffron identity.",
      "paletteProvenance": "implementation-defined",
      "colorScheme": "dark",
      "themeColor": "#111A29",
      "shell": "persistent-domain-sidebar",
      "profile": "standard",
      "density": "comfortable",
      "surfaceEmphasis": "tinted",
      "typography": "humanist",
      "geometry": "soft",
      "chartStyle": "solid",
      "effects": "quiet",
      "tokens": {
        "canvas": "#0D1420",
        "chrome": "#111A29",
        "header": "#111A29",
        "page": "#151F2E",
        "surface": "#1B2738",
        "surfaceSubtle": "#182333",
        "surfaceRaised": "#223044",
        "text": "#F3F6F9",